<?xml version="1.0" encoding="UTF-8"?>
<!DOCTYPE vet_clinic SYSTEM "VeterinaryClinic.dtd">

<vet_clinic>
  <client id="c2">
    <full_name>Nasko</full_name>
    <address>Haskovo</address>
    <phone>0888123456</phone>
  </client>
  <animal id="a2" client_id="c2">
    <name>BauBau</name>
    <type>Dog</type>
    <breed>Husky</breed>
    <age>10</age>
  </animal>
  <examination id="e1" animal_id="a2">
    <description>Grooming</description>
    <price>90</price>
  </examination>
</vet_clinic>